B1: 1 | C1: 2 | D1: 3 | E1: 4 | F1: 5 | G1: 6 | H1: 7 | I1: 8 | J1: 9 | K1: 10 | L1: 11 | M1: 12 | N1: 13 | O1: 14 | P1: 15 | Q1: 16
A2: 文章ブンショウの上手ジョウズさ（表現ヒョウゲンやまとまりの美ウツクしさ） | B2: 4 | C2: 3 | D2: 4 | E2: 3 | F2: 3 | G2: 4 | H2: 6 | I2: 3 | J2: 2 | K2: 3 | L2: 7 | M2: 1 | N2: 2 | O2: 1 | P2: 3 | Q2: 2 | S2: ※単語タンゴの表現力ヒョウゲンリョク、文章ブンショウの流ナガれ、リズム、新鮮シンセンな形容ケイヨウ、誤字ゴジ脱字ダツジ等トウ。 自分ジブンが書カきたい、真似マネしたいと思オモわせる文章ブンショウは高得点コウトクテンになる。
A3: 上手ジョウズ7
A4: このレベルの中ナカでは上手ジョウズ5
A5: このレベルの中ナカで普通フツウ3
A6: 違和感イワカンがある部分ブブンがあり、やや読ヨみ苦クルしい2
A7: 読ヨみ苦クルしい1
A8: 論説ロンセツとしての構成コウセイ | B8: 6 | C8: 3 | D8: 6 | E8: 6 | F8: 6 | G8: 6 | H8: 3 | I8: 6 | J8: 2 | K8: 6 | L8: 6 | M8: 6 | N8: 6 | O8: 6 | P8: 6 | Q8: 6 | S8: ※文章ブンショウ同士ドウシの意味イミの関連カンレンや、タイトルとの関連カンレンにおいて、 違和感イワカンがないかどうかで判断ハンダン
A9: 話題ワダイが絞シボられていて、文章ブンショウ同士ドウシの関係カンケイが明白メイハク、すらすら読ヨめる7
A10: おおむね話題ワダイが絞シボられていて、だいたいは読ヨめる6
A11: あまり話題ワダイが絞シボられておらず、文章ブンショウ同士ドウシの関係カンケイもよくわからない4
A12: 話題ワダイが拡散カクサンしており、何ナニの話ハナシをしているかよくわからない2
A13: ばらばらである0
A14: 楽タノしく読ヨめるか（例示レイジや表現ヒョウゲンの面白オモシロさ） | B14: 5 | C14: 5 | D14: 4 | E14: 3 | F14: 3 | G14: 6 | H14: 6 | I14: 2 | J14: 3 | K14: 4 | L14: 7 | M14: 3 | N14: 3 | O14: 3 | P14: 4 | Q14: 2 | S14: ※具体的グタイテキ例示レイジや状況ジョウキョウの設定セッテイ、笑ワラえる仮説カセツ等トウ、論理ロンリ性セイとは別ベツに、 どの程度テイド楽タノしませる要素ヨウソがあるか。ただし文章ブンショウの上手ジョウズさとは別ベツ。
A15: 例レイが豊富ホウフとか、楽タノしい内容ナイヨウで読ヨませる7
A16: やや例レイが豊富ホウフ、楽タノしい内容ナイヨウもある5
A17: 普通フツウ3
A18: 退屈タイクツ1
A19: 分量ブンリョウ | B19: 3 | C19: 4 | D19: 3 | E19: 3 | F19: 4 | G19: 4 | H19: 5 | I19: 3 | J19: 3 | K19: 4 | L19: 5 | M19: 4 | N19: 3 | O19: 1 | P19: 3 | Q19: 3 | S19: ※推奨スイショウサイズの80％以下イカは一律イチリツ分量ブンリョウ-1、60％以下イカは一律イチリツ分量ブンリョウ-2、 内容ナイヨウの冗長ジョウチョウさ等トウで判断ハンダン
A20: まずまずちょうどよい5
A21: 内容ナイヨウに対タイしてやや多オオすぎ、少スクなすぎ3
A22: 多オオすぎ、少スクなすぎ1
A23: 文章ブンショウについての主観的シュカンテキ補正ホセイ 基本キホン0（0〜3） | B23: 0 | C23: 0 | D23: 0 | E23: 0 | F23: 0 | G23: 0 | H23: 0 | I23: 0 | J23: 0 | K23: 0.5 | L23: 0 | M23: 0 | N23: 0 | O23: 0 | P23: 0 | Q23: 0 | S23: ※上記ジョウキ文章ブンショウ得トク点テンに対タイする補正ホセイ
A24: 文章ブンショウ合計ゴウケイ点テン | B24: =SUM(B2:B23) -> 18 | C24: =SUM(C2:C23) -> 15 | D24: =SUM(D2:D23) -> 17 | E24: =SUM(E2:E23) -> 15 | F24: =SUM(F2:F23) -> 16 | G24: =SUM(G2:G23) -> 20 | H24: =SUM(H2:H23) -> 20 | I24: =SUM(I2:I23) -> 14 | J24: =SUM(J2:J23) -> 10 | K24: =SUM(K2:K23) -> 17.5 | L24: =SUM(L2:L23) -> 25 | M24: =SUM(M2:M23) -> 14 | N24: =SUM(N2:N23) -> 14 | O24: =SUM(O2:O23) -> 11 | P24: =SUM(P2:P23) -> 16 | Q24: =SUM(Q2:Q23) -> 13
A25: 文章ブンショウ得点トクテン率リツ | B25: =B$24/26*100 -> 69.230769230769226 | C25: =C$24/26*100 -> 57.692307692307686 | D25: =D$24/26*100 -> 65.384615384615387 | E25: =E$24/26*100 -> 57.692307692307686 | F25: =F$24/26*100 -> 61.53846153846154 | G25: =G$24/26*100 -> 76.923076923076934 | H25: =H$24/26*100 -> 76.923076923076934 | I25: =I$24/26*100 -> 53.846153846153847 | J25: =J$24/26*100 -> 38.461538461538467 | K25: =K$24/26*100 -> 67.307692307692307 | L25: =L$24/26*100 -> 96.15384615384616 | M25: =M$24/26*100 -> 53.846153846153847 | N25: =N$24/26*100 -> 53.846153846153847 | O25: =O$24/26*100 -> 42.307692307692307 | P25: =P$24/26*100 -> 61.53846153846154 | Q25: =Q$24/26*100 -> 50
A27: 個々ココの分析ブンセキの鋭スルドさ（新アタラしさ） | B27: 6 | C27: 4 | D27: 3 | E27: 5 | F27: 5 | G27: 6 | H27: 5 | I27: 2 | J27: 2 | K27: 6 | L27: 6 | M27: 1 | N27: 2 | O27: 1 | P27: 4 | Q27: 3 | S27: ※一ヒトつ一ヒトつの論点ロンテンに「自分ジブンが考カンガえたことがない、新アタラしい結論ケツロン」や「漠バク 然ゼンと考カンガえていたが明確メイカクに言葉コトバにしたことがなかった結論ケツロン」などがどの 程度テイド出デているか。 細部の論理にとどまらず、全体として新しい分析装置として見た場合、 真理シンリをついているか。 またそれは充分ジュウブンに正タダしいか、応用性オウヨウセイは高タカいか。
A28: なるほど気付キヅかなかった（考カンガえてなかった）レベルがよくでる7
A29: なるほど気付キヅかなかったレベルがあり、なるほど確タシかにねレベルがよくでる6
A30: なるほど確タシかにねレベルがよくでる5
A31: なるほど確タシかにレベルがあり、ふむまあそうだレベルがよくでる4
A32: ふむふむそうだレベルがよくでる3
A33: ふむふむそうだレベルもない、凡庸ボンヨウ2
A34: 何ナニも得エられない1
A35: 答コタえの正確セイカクさ、論理ロンリ | B35: 5 | C35: 5 | D35: 3 | E35: 5 | F35: 3 | G35: 3 | H35: 3 | I35: 3 | J35: 2 | K35: 5 | L35: 5 | M35: 5 | N35: 2 | O35: 1 | P35: 2 | Q35: 2 | S35: ※一ヒトつ一ヒトつの結論ケツロンに誤アヤマりがないか、少スクなくとも論理的ロンリテキか 知識チシキ的テキなミスもここで評価ヒョウカ。
A36: 間違マチガった答コタえは出デてこない5
A37: 間違マチガった答コタえはないが、かなりの論理ロンリ飛躍ヒヤクがある4
A38: 間違マチガった答コタえが出デるが、一通ヒトトオり論理的ロンリテキに書カかれている3
A39: 間違マチガった答コタえが出デる上ウエ、いまいち論理的ロンリテキでもない2
A40: 間違マチガった答コタえが多オオく、論理的ロンリテキでない1
A41: お題ダイとの整合性セイゴウセイ | B41: 5 | C41: 3 | D41: 3 | E41: 5 | F41: 5 | G41: 5 | H41: 4 | I41: 5 | J41: 5 | K41: 5 | L41: 5 | M41: 1 | N41: 5 | O41: 5 | P41: 4 | Q41: 5 | S41: ※お題ダイとの関連性カンレンセイはどうか
A42: ぴったり5
A43: 関連カンレンあり3
A44: ほとんど無視ムシ1
A45: 全体ゼンタイとしての主張シュチョウ・結論ケツロンに、 （正タダしくて）意外イガイな結論ケツロンがあったり、知的チテキ刺激シゲキがあったか | B45: 2 | C45: 1 | D45: 1 | E45: 3 | F45: 3 | G45: 3 | H45: 3 | I45: 1 | J45: 1 | K45: 3 | L45: 4 | M45: 1 | N45: 1 | O45: 1 | P45: 3 | Q45: 2 | S45: ※いわゆる凡庸ボンヨウな主張シュチョウの反復ハンプクになっていないか。 思想シソウ書ショの解説カイセツ的テキな退屈タイクツなものではなく、珍メズラしい立場タチバや独自ドクジの観点カンテン にどれだけ立タっているか。
A46: 多オオいに刺激シゲキがあった5
A47: 刺激シゲキがあった4
A48: 少スコし面白オモシロかった3
A49: 特トクにない2
A50: やや退屈タイクツ、凡庸ボンヨウ1
A51: 分析ブンセキ・論理ロンリについての主観的シュカンテキ補正ホセイ 基本キホンは0（0〜3点テン） | B51: 0 | C51: 0 | D51: 0 | E51: 0 | F51: 0 | G51: 1 | H51: 0 | I51: 0 | J51: 0 | K51: 1 | L51: 0 | M51: 0 | N51: 0 | O51: 0 | P51: 0 | Q51: 0 | S51: ※上記ジョウキ論理ロンリ分析ブンセキ得点トクテンに対タイする補正ホセイ
A52: 論理ロンリ分析ブンセキ合計ゴウケイ点テン | B52: =SUM(B27:B51) -> 18 | C52: =SUM(C27:C51) -> 13 | D52: =SUM(D27:D51) -> 10 | E52: =SUM(E27:E51) -> 18 | F52: =SUM(F27:F51) -> 16 | G52: =SUM(G27:G51) -> 18 | H52: =SUM(H27:H51) -> 15 | I52: =SUM(I27:I51) -> 11 | J52: =SUM(J27:J51) -> 10 | K52: =SUM(K27:K51) -> 20 | L52: =SUM(L27:L51) -> 20 | M52: =SUM(M27:M51) -> 8 | N52: =SUM(N27:N51) -> 10 | O52: =SUM(O27:O51) -> 8 | P52: =SUM(P27:P51) -> 13 | Q52: =SUM(Q27:Q51) -> 12
A53: 論理ロンリ分析ブンセキ得点トクテン率リツ | B53: =B$52/22*100 -> 81.818181818181827 | C53: =C$52/22*100 -> 59.090909090909093 | D53: =D$52/22*100 -> 45.454545454545453 | E53: =E$52/22*100 -> 81.818181818181827 | F53: =F$52/22*100 -> 72.727272727272734 | G53: =G$52/22*100 -> 81.818181818181827 | H53: =H$52/22*100 -> 68.181818181818173 | I53: =I$52/22*100 -> 50 | J53: =J$52/22*100 -> 45.454545454545453 | K53: =K$52/22*100 -> 90.909090909090907 | L53: =L$52/22*100 -> 90.909090909090907 | M53: =M$52/22*100 -> 36.363636363636367 | N53: =N$52/22*100 -> 45.454545454545453 | O53: =O$52/22*100 -> 36.363636363636367 | P53: =P$52/22*100 -> 59.090909090909093 | Q53: =Q$52/22*100 -> 54.54545454545454
A55: 主観的シュカンテキ評価ヒョウカ | B55: 6 | C55: 3 | D55: 4 | E55: 6 | F55: 6 | G55: 6 | H55: 6 | I55: 5 | J55: 3 | K55: 6 | L55: 7 | M55: 2 | N55: 3 | O55: 0 | P55: 5 | Q55: 4 | S55: ※全スベてを総合ソウゴウした上ウエでの「読ヨみたさ」。 これと同オナじ文章ブンショウがたくさん並ナラんでいるとして、読ヨみたいかどうか。
A56: また読ヨみたいか
A57: 別ベツの作品サクヒンも読ヨんでみたい、今イマもう一ヒトつあればもう一ヒトつ読ヨむ7
A58: 次回ジカイもぜひ投稿トウコウしてほしい6
A59: 今イマすぐに読ヨむ気キは起オきないが、まずまず読ヨむこともできる5
A60: こうした作品サクヒンがたくさん並ナラんでいるなら、基本キホン的テキにあまり読ヨみたくない3
A61: 得エられるものが少スクなく、疲ツカれる、だるい1
A62: 投稿トウコウしてほしくない0
A63: 主観的シュカンテキ評価ヒョウカ得点トクテン率リツ | B63: =SUM(B55)/7*100 -> 85.714285714285708 | C63: =SUM(C55)/7*100 -> 42.857142857142854 | D63: =SUM(D55)/7*100 -> 57.142857142857139 | E63: =SUM(E55)/7*100 -> 85.714285714285708 | F63: =SUM(F55)/7*100 -> 85.714285714285708 | G63: =SUM(G55)/7*100 -> 85.714285714285708 | H63: =SUM(H55)/7*100 -> 85.714285714285708 | I63: =SUM(I55)/7*100 -> 71.428571428571431 | J63: =SUM(J55)/7*100 -> 42.857142857142854 | K63: =SUM(K55)/7*100 -> 85.714285714285708 | L63: =SUM(L55)/7*100 -> 100 | M63: =SUM(M55)/7*100 -> 28.571428571428569 | N63: =SUM(N55)/7*100 -> 42.857142857142854 | O63: =SUM(O55)/7*100 -> 0 | P63: =SUM(P55)/7*100 -> 71.428571428571431 | Q63: =SUM(Q55)/7*100 -> 57.142857142857139
A65: 総得点ソウトクテン（40％・文章ブンショウ％ ＋ 40％・論理ロンリ％ ＋ 20％・主観シュカン％）*100 | B65: =(B25/100*2+B53/100*2+B63/100)/5*100 -> 77.562437562437552 | C65: =(C25/100*2+C53/100*2+C63/100)/5*100 -> 55.284715284715283 | D65: =(D25/100*2+D53/100*2+D63/100)/5*100 -> 55.764235764235757 | E65: =(E25/100*2+E53/100*2+E63/100)/5*100 -> 72.947052947052953 | F65: =(F25/100*2+F53/100*2+F63/100)/5*100 -> 70.84915084915086 | G65: =(G25/100*2+G53/100*2+G63/100)/5*100 -> 80.639360639360632 | H65: =(H25/100*2+H53/100*2+H63/100)/5*100 -> 75.184815184815193 | I65: =(I25/100*2+I53/100*2+I63/100)/5*100 -> 55.824175824175825 | J65: =(J25/100*2+J53/100*2+J63/100)/5*100 -> 42.137862137862136 | K65: =(K25/100*2+K53/100*2+K63/100)/5*100 -> 80.429570429570418 | L65: =(L25/100*2+L53/100*2+L63/100)/5*100 -> 94.825174825174827 | M65: =(M25/100*2+M53/100*2+M63/100)/5*100 -> 41.798201798201795 | N65: =(N25/100*2+N53/100*2+N63/100)/5*100 -> 48.291708291708282 | O65: =(O25/100*2+O53/100*2+O63/100)/5*100 -> 31.46853146853147 | P65: =(P25/100*2+P53/100*2+P63/100)/5*100 -> 62.537462537462538 | Q65: =(Q25/100*2+Q53/100*2+Q63/100)/5*100 -> 53.246753246753244
A66: 補正ホセイがある場合バアイ、その理由リユウを記述キジュツ その他タ特記トッキ事項ジコウ | G66: 議論ギロンの進ススめ方カタは緻密チミツで、やや新アタラしいことを述ノべようとしているため飛躍ヒヤクっぽいものがあるが、全体ゼンタイとして減点ゲンテンするには至イタらないと判断ハンダンしたため。 | K66: 表現について、一定イッテイの工夫がみられる。 分析ブンセキについては、丁寧テイネイに詳細ショウサイに記述キジュツしている点テンでの補正ホセイ。 | P66: やや独断ドクダン的テキな表現ヒョウゲンがあったり、不適切フテキセツな関数カンスウの例レイ（循環ジュンカン論法ロンポウ）が目立メダつ。
A67: 感想等カンソウトウ
A69: 点数テンスウを1〜10点テンに振フり分ワける引ヒき伸ノばし
A70: 最高点サイコウテン（自分ジブンの作品サクヒンを除ノゾく） | B70: =G65 -> 80.639360639360632
A71: 最低サイテイ点テン | B71: =O65 -> 31.46853146853147
A72: 得点トクテン差サ | B72: =B70-B71 -> 49.170829170829165
A73: 実ジツ得点トクテン１点テンあたりの評価ヒョウカの差サ | B73: =9/B72 -> 0.18303535148313696
A74: 各々オノオノの得点トクテンの調整チョウセイ得点トクテン（最低サイテイ1点テン、最高サイコウ10点テンとなるよう単純タンジュンに引ヒき伸ノばし。自分ジブンの作品サクヒンを除ノゾく） | B74: =(B65-$B71)*$B73+1 -> 9.4368143031288092 | C74: =(C65-$B71)*$B73+1 -> 5.3592035757822023 | D74: =(D65-$B71)*$B73+1 -> 5.4469727752945944 | E74: =(E65-$B71)*$B73+1 -> 8.5920357578220248 | F74: =(F65-$B71)*$B73+1 -> 8.2080455099553049 | G74: =(G65-$B71)*$B73+1 -> 10 | H74: =(H65-$B71)*$B73+1 -> 9.001625355546528 | I74: =(I65-$B71)*$B73+1 -> 5.4579439252336455 | J74: =(J65-$B71)*$B73+1 -> 2.9528646891507515 | K74: =(K65-$B71)*$B73+1 -> 9.9616009752133277 | L74: =(L65-$B71)*$B73+1 -> 12.596505485574971 | M74: =(M65-$B71)*$B73+1 -> 2.8906948394961391 | N74: =(N65-$B71)*$B73+1 -> 4.0792360828931313 | O74: =(O65-$B71)*$B73+1 -> 1 | P74: =(P65-$B71)*$B73+1 -> 6.6867127184071524 | Q74: =(Q65-$B71)*$B73+1 -> 4.9861844778545308
A75: 最終サイシュウ得点トクテン | B75: 9 | C75: 5 | D75: 5 | E75: 9 | F75: 8 | G75: 10 | H75: 9 | I75: 5 | J75: 3 | K75: 10 | L75: 13 | M75: 3 | N75: 4 | O75: 1 | P75: 7 | Q75: 5